{"byte_length":255,"collected_at":"2026-07-26T06:00:00+00:00","collector_version":"synthetic-fixture/1.0.0","content_hash":"sha256:08159489ee4536ceb8d5876a26acf37d29b2d06ce4ff8998985bae76821c0f3d","content_type":"application/xml","document_id":"21000000000000000000000000000002","document_role":"list_item","external_id":"SYN-BOK-002","http_status":200,"parent_document_id":"20000000000000000000000000000000","raw_format":"xml","raw_payload_base64":"PHNlcnZMaXN0PjxzZXJ2SWQ+U1lOLUJPSy0wMDI8L3NlcnZJZD48c2Vydk5tPu2VqeyEsSDrqqnroZ0g7KCE7JqpIOyngOybkDwvc2Vydk5tPjxqdXJNbm9mTm0+7ZWp7ISxIOuzteyngOu2gOyymDwvanVyTW5vZk5tPjxzZXJ2RGdzdD7sg4HshLjqsIAg7JeG64qUIO2VqeyEsSDrqqnroZ0g7IKs66GAPC9zZXJ2RGdzdD48c2VydkR0bExpbms+aHR0cHM6Ly9maXh0dXJlLmludmFsaWQvYm9ramlyby8wMDI8L3NlcnZEdGxMaW5rPjwvc2Vydkxpc3Q+","schema_version":"1.0.0","source_id":"bokjiro-central-welfare-api","source_type":"api","source_url":"https://fixture.invalid/bokjiro/list"}
