{"byte_length":649,"collected_at":"2026-07-26T06:00:00+00:00","collector_version":"synthetic-fixture/1.0.0","content_hash":"sha256:d2d2de4c10a3eb1b62f3390418c75c3439a71e0f142b5854e0c7c2408e7b8a03","content_type":"application/json","document_id":"11000000000000000000000000000001","document_role":"list_item","external_id":"SYN-YOUTH-001","http_status":200,"parent_document_id":"10000000000000000000000000000000","raw_format":"json","raw_payload_base64":"eyJhZGRBcGx5UWxmY0NuZENuIjoiIiwiYXBseVByZFNlQ2QiOiIwMDU3MDAxIiwiYXBseVVybEFkZHIiOiIiLCJhcGx5WW1kIjoiMjAyNi4gMS4gMS4gfiAyMDI2LiA2LiAzMC4iLCJsY2xzZk5tIjoi7KO86rGwIiwibWNsc2ZObSI6IuyjvOqxsOu5hCDsp4Dsm5AiLCJvcGVySW5zdENkTm0iOiLtlanshLEg7KO86rGw6riw6rSAIiwicGxjeUFwbHlNdGhkQ24iOiLsmKjrnbzsnbgg7Iug7LKtIiwicGxjeUV4cGxuQ24iOiLtlanshLEg7LKt64WEIOyjvOqxsCDsoJXssYUg7JqU7JW9IiwicGxjeUt5d2RObSI6IuyblOyEuCzrs7TsobDquIgiLCJwbGN5Tm0iOiI8Yj7tlanshLEg7LKt64WEIOyjvOqxsCDsp4Dsm5A8L2I+IiwicGxjeU5vIjoiU1lOLVlPVVRILTAwMSIsInBsY3lTcHJ0Q24iOiI8cD7tlanshLEg7JuUIOyngOybkDwvcD4iLCJwdGNwUHJwVHJndENuIjoi7ZWp7ISxIOyyreuFhCDrjIDsg4EiLCJyZWZVcmxBZGRyMSI6Imh0dHBzOi8vZml4dHVyZS5pbnZhbGlkL3lvdXRoLzAwMSIsInJlZlVybEFkZHIyIjoiIiwicmd0ckluc3RDZE5tIjoi7ZWp7ISxIOuTseuhneq4sOq0gCIsInNwcnRUcmd0QWdlTG10WW4iOiJZIiwic3BydFRyZ3RNYXhBZ2UiOiIzNCIsInNwcnRUcmd0TWluQWdlIjoiMTkiLCJ6aXBDZCI6IuyEnOyauOyLnCJ9Cg==","schema_version":"1.0.0","source_id":"youthcenter-api","source_type":"api","source_url":"https://fixture.invalid/youthcenter/getPlcy"}
