{"byte_length":456,"collected_at":"2026-07-26T06:00:00+00:00","collector_version":"synthetic-fixture/1.0.0","content_hash":"sha256:9c536a8b315e01159d3e65d66fa842edaf18c7097cbcf5c60eb44cf0fc4ebf03","content_type":"application/json","document_id":"11000000000000000000000000000002","document_role":"list_item","external_id":"SYN-YOUTH-002","http_status":200,"parent_document_id":"10000000000000000000000000000000","raw_format":"json","raw_payload_base64":"eyJhZGRBcGx5UWxmY0NuZENuIjoiIiwiYXBseVByZFNlQ2QiOiIwMDU3MDAyIiwiYXBseVVybEFkZHIiOiIiLCJhcGx5WW1kIjoiIiwibGNsc2ZObSI6Iuq4iOycte+9peuzteyngO+9peusuO2ZlCIsIm9wZXJJbnN0Q2RObSI6IiIsInBsY3lBcGx5TXRoZENuIjoiIiwicGxjeU5tIjoi7ZWp7ISxIOyDgeyLnCDsg53tmZwg7KeA7JuQIiwicGxjeU5vIjoiU1lOLVlPVVRILTAwMiIsInBsY3lTcHJ0Q24iOiLtlanshLEg7IOd7ZmcIOyngOybkCIsInB0Y3BQcnBUcmd0Q24iOiIiLCJyZWZVcmxBZGRyMSI6Imh0dHBzOi8vZml4dHVyZS5pbnZhbGlkL3lvdXRoLzAwMiIsInJlZlVybEFkZHIyIjoiIiwicmd0ckluc3RDZE5tIjoi7ZWp7ISxIOuTseuhneq4sOq0gCIsInNwcnRUcmd0QWdlTG10WW4iOiJOIiwic3BydFRyZ3RNYXhBZ2UiOiIiLCJzcHJ0VHJndE1pbkFnZSI6IiIsInppcENkIjoi7KCE6rWtIn0K","schema_version":"1.0.0","source_id":"youthcenter-api","source_type":"api","source_url":"https://fixture.invalid/youthcenter/getPlcy"}
