{"byte_length":578,"collected_at":"2026-07-26T06:00:00+00:00","collector_version":"synthetic-fixture/1.0.0","content_hash":"sha256:7d64e81c498ec1ba442c28c44c0b8092e7b7ea21e5db398c4f3430629cf256c6","content_type":"application/xml","document_id":"20000000000000000000000000000000","document_role":"list_response","external_id":null,"http_status":200,"parent_document_id":null,"raw_format":"xml","raw_payload_base64":"PHdhbnRlZExpc3Q+PHNlcnZMaXN0PjxzZXJ2SWQ+U1lOLUJPSy0wMDE8L3NlcnZJZD48c2Vydk5tPu2VqeyEsSDssq3rhYQg7J6Q7IKwIOyngOybkDwvc2Vydk5tPjxqdXJNbm9mTm0+7ZWp7ISxIOuzteyngOu2gOyymDwvanVyTW5vZk5tPjxpbnRyc1RoZW1hQXJyYXk+7ISc66+86riI7Jy1LOyDne2ZnOyngOybkDwvaW50cnNUaGVtYUFycmF5PjxzZXJ2RGdzdD7tlanshLEg66qp66GdIOyalOyVvTwvc2VydkRnc3Q+PHNlcnZEdGxMaW5rPmh0dHBzOi8vZml4dHVyZS5pbnZhbGlkL2Jva2ppcm8vMDAxPC9zZXJ2RHRsTGluaz48L3NlcnZMaXN0PjxzZXJ2TGlzdD48c2VydklkPlNZTi1CT0stMDAyPC9zZXJ2SWQ+PHNlcnZObT7tlanshLEg66qp66GdIOyghOyaqSDsp4Dsm5A8L3NlcnZObT48anVyTW5vZk5tPu2VqeyEsSDrs7Xsp4DrtoDsspg8L2p1ck1ub2ZObT48c2VydkRnc3Q+7IOB7IS46rCAIOyXhuuKlCDtlanshLEg66qp66GdIOyCrOuhgDwvc2VydkRnc3Q+PHNlcnZEdGxMaW5rPmh0dHBzOi8vZml4dHVyZS5pbnZhbGlkL2Jva2ppcm8vMDAyPC9zZXJ2RHRsTGluaz48L3NlcnZMaXN0Pjwvd2FudGVkTGlzdD4=","schema_version":"1.0.0","source_id":"bokjiro-central-welfare-api","source_type":"api","source_url":"https://fixture.invalid/bokjiro/list"}
