{"byte_length":1836,"collected_at":"2026-07-26T06:00:00+00:00","collector_version":"synthetic-fixture/1.0.0","content_hash":"sha256:2b3fe0c43ce44aeaeec80dc712e4c8efe9c30b2289b091ac5de2dc54feefe403","content_type":"application/json","document_id":"10000000000000000000000000000000","document_role":"list_response","external_id":null,"http_status":200,"parent_document_id":null,"raw_format":"json","raw_payload_base64":"eyJyZXN1bHQiOnsicmVzdWx0Q29kZSI6IjIwMCIsInlvdXRoUG9saWN5TGlzdCI6W3siYWRkQXBseVFsZmNDbmRDbiI6IiIsImFwbHlQcmRTZUNkIjoiMDA1NzAwMSIsImFwbHlVcmxBZGRyIjoiIiwiYXBseVltZCI6IjIwMjYuIDEuIDEuIH4gMjAyNi4gNi4gMzAuIiwibGNsc2ZObSI6IuyjvOqxsCIsIm1jbHNmTm0iOiLso7zqsbDruYQg7KeA7JuQIiwib3Blckluc3RDZE5tIjoi7ZWp7ISxIOyjvOqxsOq4sOq0gCIsInBsY3lBcGx5TXRoZENuIjoi7Jio65287J24IOyLoOyyrSIsInBsY3lFeHBsbkNuIjoi7ZWp7ISxIOyyreuFhCDso7zqsbAg7KCV7LGFIOyalOyVvSIsInBsY3lLeXdkTm0iOiLsm5TshLgs67O07KGw6riIIiwicGxjeU5tIjoiPGI+7ZWp7ISxIOyyreuFhCDso7zqsbAg7KeA7JuQPC9iPiIsInBsY3lObyI6IlNZTi1ZT1VUSC0wMDEiLCJwbGN5U3BydENuIjoiPHA+7ZWp7ISxIOyblCDsp4Dsm5A8L3A+IiwicHRjcFBycFRyZ3RDbiI6Iu2VqeyEsSDssq3rhYQg64yA7IOBIiwicmVmVXJsQWRkcjEiOiJodHRwczovL2ZpeHR1cmUuaW52YWxpZC95b3V0aC8wMDEiLCJyZWZVcmxBZGRyMiI6IiIsInJndHJJbnN0Q2RObSI6Iu2VqeyEsSDrk7HroZ3quLDqtIAiLCJzcHJ0VHJndEFnZUxtdFluIjoiWSIsInNwcnRUcmd0TWF4QWdlIjoiMzQiLCJzcHJ0VHJndE1pbkFnZSI6IjE5IiwiemlwQ2QiOiLshJzsmrjsi5wifSx7ImFkZEFwbHlRbGZjQ25kQ24iOiIiLCJhcGx5UHJkU2VDZCI6IjAwNTcwMDIiLCJhcGx5VXJsQWRkciI6IiIsImFwbHlZbWQiOiIiLCJsY2xzZk5tIjoi6riI7Jy1772l67O17KeA772l66y47ZmUIiwibWNsc2ZObSI6IuyDne2ZnOyngOybkCIsIm9wZXJJbnN0Q2RObSI6IiIsInBsY3lBcGx5TXRoZENuIjoiIiwicGxjeUV4cGxuQ24iOiLtlanshLEg7IOB7IucIOyDne2ZnCDsoJXssYUg7JqU7JW9IiwicGxjeUt5d2RObSI6IuyDne2ZnOu5hCIsInBsY3lObSI6Iu2VqeyEsSDsg4Hsi5wg7IOd7ZmcIOyngOybkCIsInBsY3lObyI6IlNZTi1ZT1VUSC0wMDIiLCJwbGN5U3BydENuIjoi7ZWp7ISxIOyDne2ZnCDsp4Dsm5AiLCJwdGNwUHJwVHJndENuIjoiIiwicmVmVXJsQWRkcjEiOiJodHRwczovL2ZpeHR1cmUuaW52YWxpZC95b3V0aC8wMDIiLCJyZWZVcmxBZGRyMiI6IiIsInJndHJJbnN0Q2RObSI6Iu2VqeyEsSDrk7HroZ3quLDqtIAiLCJzcHJ0VHJndEFnZUxtdFluIjoiTiIsInNwcnRUcmd0TWF4QWdlIjoiIiwic3BydFRyZ3RNaW5BZ2UiOiIiLCJ6aXBDZCI6IuyghOq1rSJ9LHsiYWRkQXBseVFsZmNDbmRDbiI6IiIsImFwbHlQcmRTZUNkIjoiMDA1NzAwMyIsImFwbHlVcmxBZGRyIjoiIiwiYXBseVltZCI6IiIsImxjbHNmTm0iOiLquLDtg4AiLCJtY2xzZk5tIjoi6riw7YOA7KeA7JuQIiwib3Blckluc3RDZE5tIjoi7ZWp7ISxIOyYpOulmOq4sOq0gCIsInBsY3lBcGx5TXRoZENuIjoiIiwicGxjeUV4cGxuQ24iOiLtlYTsiJgg7KCc66qp7J20IOyXhuuKlCDtlanshLEg7KCV7LGFIOyalOyVvSIsInBsY3lLeXdkTm0iOiLtlanshLHsmKTrpZgiLCJwbGN5Tm0iOiIiLCJwbGN5Tm8iOiJTWU4tWU9VVEgtUkVKRUNURUQiLCJwbGN5U3BydENuIjoi7ZWE7IiYIOygnOuqqeydtCDsl4bripQg7ZWp7ISxIOyLpO2MqCDsgqzroYAiLCJwdGNwUHJwVHJndENuIjoiIiwicmVmVXJsQWRkcjEiOiJodHRwczovL2ZpeHR1cmUuaW52YWxpZC95b3V0aC9yZWplY3RlZCIsInJlZlVybEFkZHIyIjoiIiwicmd0ckluc3RDZE5tIjoi7ZWp7ISxIOuTseuhneq4sOq0gCIsInNwcnRUcmd0QWdlTG10WW4iOiJOIiwic3BydFRyZ3RNYXhBZ2UiOiIiLCJzcHJ0VHJndE1pbkFnZSI6IiIsInppcENkIjoi7KCE6rWtIn1dfX0K","schema_version":"1.0.0","source_id":"youthcenter-api","source_type":"api","source_url":"https://fixture.invalid/youthcenter/getPlcy"}
