{"byte_length":375,"collected_at":"2026-07-26T06:00:00+00:00","collector_version":"synthetic-fixture/1.0.0","content_hash":"sha256:58d9cc0b7ba2a16f73bea234d9e1a1c927fd984132f5f35848a738c2eec28a26","content_type":"application/xml","document_id":"21000000000000000000000000000001","document_role":"list_item","external_id":"SYN-BOK-001","http_status":200,"parent_document_id":"20000000000000000000000000000000","raw_format":"xml","raw_payload_base64":"PHNlcnZMaXN0PjxzZXJ2SWQ+U1lOLUJPSy0wMDE8L3NlcnZJZD48c2Vydk5tPu2VqeyEsSDssq3rhYQg7J6Q7IKwIOyngOybkDwvc2Vydk5tPjxqdXJNbm9mTm0+7ZWp7ISxIOuzteyngOu2gOyymDwvanVyTW5vZk5tPjxpbnRyc1RoZW1hQXJyYXk+7ISc66+86riI7Jy1LOyDne2ZnOyngOybkDwvaW50cnNUaGVtYUFycmF5PjxsaWZlQXJyYXk+7LKt64WEPC9saWZlQXJyYXk+PHRyZ3RlckluZHZkbEFycmF5PuyggOyGjOuTnTwvdHJndGVySW5kdmRsQXJyYXk+PHNlcnZEZ3N0Pu2VqeyEsSDrqqnroZ0g7JqU7JW9PC9zZXJ2RGdzdD48c2VydkR0bExpbms+aHR0cHM6Ly9maXh0dXJlLmludmFsaWQvYm9ramlyby8wMDE8L3NlcnZEdGxMaW5rPjwvc2Vydkxpc3Q+","schema_version":"1.0.0","source_id":"bokjiro-central-welfare-api","source_type":"api","source_url":"https://fixture.invalid/bokjiro/list"}
