{"byte_length":464,"collected_at":"2026-07-26T06:00:00+00:00","collector_version":"synthetic-fixture/1.0.0","content_hash":"sha256:00b2c8e707b259299c48a4e983a9e0d5ac3af1a0e124beca5efbb82f2b283af2","content_type":"application/json","document_id":"11000000000000000000000000000003","document_role":"list_item","external_id":"SYN-YOUTH-REJECTED","http_status":200,"parent_document_id":"10000000000000000000000000000000","raw_format":"json","raw_payload_base64":"eyJhZGRBcGx5UWxmY0NuZENuIjoiIiwiYXBseVByZFNlQ2QiOiIwMDU3MDAzIiwiYXBseVVybEFkZHIiOiIiLCJhcGx5WW1kIjoiIiwibGNsc2ZObSI6Iuq4sO2DgCIsIm9wZXJJbnN0Q2RObSI6Iu2VqeyEsSDsmKTrpZjquLDqtIAiLCJwbGN5QXBseU10aGRDbiI6IiIsInBsY3lObSI6IiIsInBsY3lObyI6IlNZTi1ZT1VUSC1SRUpFQ1RFRCIsInBsY3lTcHJ0Q24iOiLtlYTsiJgg7KCc66qp7J20IOyXhuuKlCDtlanshLEg7Iuk7YyoIOyCrOuhgCIsInB0Y3BQcnBUcmd0Q24iOiIiLCJyZWZVcmxBZGRyMSI6Imh0dHBzOi8vZml4dHVyZS5pbnZhbGlkL3lvdXRoL3JlamVjdGVkIiwicmVmVXJsQWRkcjIiOiIiLCJyZ3RySW5zdENkTm0iOiLtlanshLEg65Ox66Gd6riw6rSAIiwic3BydFRyZ3RBZ2VMbXRZbiI6Ik4iLCJzcHJ0VHJndE1heEFnZSI6IiIsInNwcnRUcmd0TWluQWdlIjoiIiwiemlwQ2QiOiLsoITqta0ifQo=","schema_version":"1.0.0","source_id":"youthcenter-api","source_type":"api","source_url":"https://fixture.invalid/youthcenter/getPlcy"}
