{"byte_length":539,"collected_at":"2026-07-26T06:01:00+00:00","collector_version":"synthetic-fixture/1.0.0","content_hash":"sha256:fcb900c875f107ca0493e1a677356bdbcb6696f9de6c09ae73bb5259412933e4","content_type":"application/xml","document_id":"22000000000000000000000000000001","document_role":"detail_response","external_id":"SYN-BOK-001","http_status":200,"parent_document_id":null,"raw_format":"xml","raw_payload_base64":"PHdhbnRlZER0bD48c2VydklkPlNZTi1CT0stMDAxPC9zZXJ2SWQ+PHNlcnZObT7tlanshLEg7LKt64WEIOyekOyCsCDsp4Dsm5Ag7IOB7IS4PC9zZXJ2Tm0+PGp1ck1ub2ZObT7tlanshLEg67O17KeA67aA7LKYPC9qdXJNbm9mTm0+PHRndHJEdGxDbj7tlanshLEg7KeA7JuQIOuMgOyDgTwvdGd0ckR0bENuPjxzbGN0Q3JpdENuPu2VqeyEsSDshKDsoJUg6riw7KSAPC9zbGN0Q3JpdENuPjx3bGZhcmVJbmZvT3V0bENuPu2VqeyEsSDsg4HshLgg7KCV7LGFIOqwnOyalDwvd2xmYXJlSW5mb091dGxDbj48aW50cnNUaGVtYUFycmF5PuyjvOqxsCwg7ISc66+86riI7Jy1PC9pbnRyc1RoZW1hQXJyYXk+PGxpZmVBcnJheT7ssq3rhYQ8L2xpZmVBcnJheT48dHJndGVySW5kdmRsQXJyYXk+7KCA7IaM65OdIOyyreuFhDwvdHJndGVySW5kdmRsQXJyYXk+PGFsd1NlcnZDbj7tlanshLEg7IOB7IS4IOyngOybkCDrgrTsmqk8L2Fsd1NlcnZDbj48c2VydlNlQ29kZT4wMTwvc2VydlNlQ29kZT48c2VydlNlQ29kZT4wMjwvc2VydlNlQ29kZT48L3dhbnRlZER0bD4=","schema_version":"1.0.0","source_id":"bokjiro-central-welfare-api","source_type":"api","source_url":"https://fixture.invalid/bokjiro/detail"}
